{
  "schema_version": 1,
  "kind": "lesson",
  "id": "save-oriented-caption",
  "category": "channel",
  "scope": [
    "instagram",
    "carousel"
  ],
  "status": "hypothesis",
  "finding": "A useful practical rule and one save-oriented action may improve saves/shares for this full carousel.",
  "evidence": {
    "kind": "private_file",
    "ref": ".scratch/channel-audit/first-carousel-experiment-20261026/REVIEW.md",
    "observed_at": "2026-10-26",
    "result": "Draft prepared; no engagement or conversion result yet."
  },
  "revisit_when": "Compare dated exposed results with relevant comparable posts, preserving sample limits.",
  "supersedes": null
}
