{
  "schema_version": 1,
  "kind": "lesson",
  "id": "file-chooser-handoff",
  "category": "tool",
  "scope": [
    "buffer"
  ],
  "status": "observed",
  "finding": "The browser file-chooser handoff timed out. A desktop-wide Open dialog lacked reliable target ownership. Use the verified image route for the same case; do not repeatedly probe an uncertain native dialog.",
  "evidence": {
    "kind": "private_file",
    "ref": ".scratch/channel-audit/first-carousel-experiment-20261026/intent.json",
    "observed_at": "2026-10-26",
    "result": "No PDF attachment was claimed; no uncertain file path was entered."
  },
  "revisit_when": "The documented chooser can be boundedly tested in a known owned target.",
  "supersedes": null
}
